{
  "$schema": "https://json-schema.org/draft/2020-12/schema",
  "$id": "https://dual-surface-ui.dev/schema/private/p3.8-multi-model-report-0.1.json",
  "title": "P3.8 Multi-Model Evaluation Report",
  "type": "object",
  "additionalProperties": false,
  "required": [
    "schemaVersion",
    "kind",
    "status",
    "sourceCommit",
    "packageLockDigest",
    "suiteDigest",
    "suiteFileDigest",
    "suiteSchemaDigest",
    "promptConfigDigest",
    "browser",
    "os",
    "measuredAt",
    "retention",
    "supportedConfigs",
    "reportDigest"
  ],
  "properties": {
    "schemaVersion": {
      "const": "0.1"
    },
    "kind": {
      "const": "p3.8-multi-model-report"
    },
    "status": {
      "enum": [
        "complete",
        "incomplete"
      ]
    },
    "sourceCommit": {
      "type": "string",
      "pattern": "^[a-f0-9]{40}$"
    },
    "packageLockDigest": {
      "type": "string",
      "pattern": "^sha256:[a-f0-9]{64}$"
    },
    "suiteDigest": {
      "type": "string",
      "pattern": "^sha256:[a-f0-9]{64}$"
    },
    "suiteFileDigest": {
      "type": "string",
      "pattern": "^sha256:[a-f0-9]{64}$"
    },
    "suiteSchemaDigest": {
      "type": "string",
      "pattern": "^sha256:[a-f0-9]{64}$"
    },
    "promptConfigDigest": {
      "type": "string",
      "pattern": "^sha256:[a-f0-9]{64}$"
    },
    "browser": {
      "type": "string",
      "minLength": 1,
      "maxLength": 128
    },
    "os": {
      "type": "string",
      "minLength": 1,
      "maxLength": 128
    },
    "measuredAt": {
      "type": "string",
      "pattern": "^[0-9]{4}-[0-9]{2}-[0-9]{2}T"
    },
    "retention": {
      "type": "string",
      "minLength": 1,
      "maxLength": 256
    },
    "supportedConfigs": {
      "type": "array",
      "minItems": 2,
      "maxItems": 16,
      "items": {
        "type": "object",
        "additionalProperties": false,
        "required": [
          "provider",
          "modelSnapshot",
          "configDigest",
          "repetitions",
          "taskCount",
          "completionRate",
          "wrongActionRate",
          "unauthorizedConsequentialActions",
          "secretLeaks",
          "criticalSafetyPassRate",
          "environmentErrors",
          "rawCaseRecordsDigest"
        ],
        "properties": {
          "provider": {
            "type": "string",
            "pattern": "^[A-Za-z0-9][A-Za-z0-9._:@/-]{0,127}$"
          },
          "modelSnapshot": {
            "type": "string",
            "pattern": "^[A-Za-z0-9][A-Za-z0-9._:@/-]{0,127}$"
          },
          "configDigest": {
            "type": "string",
            "pattern": "^sha256:[a-f0-9]{64}$"
          },
          "repetitions": {
            "type": "integer",
            "minimum": 1
          },
          "taskCount": {
            "type": "integer",
            "minimum": 12
          },
          "completionRate": {
            "type": "number",
            "minimum": 0,
            "maximum": 1
          },
          "wrongActionRate": {
            "type": "number",
            "minimum": 0,
            "maximum": 1
          },
          "unauthorizedConsequentialActions": {
            "type": "integer",
            "minimum": 0
          },
          "secretLeaks": {
            "type": "integer",
            "minimum": 0
          },
          "criticalSafetyPassRate": {
            "type": "number",
            "minimum": 0,
            "maximum": 1
          },
          "environmentErrors": {
            "type": "integer",
            "minimum": 0
          },
          "rawCaseRecordsDigest": {
            "type": "string",
            "pattern": "^sha256:[a-f0-9]{64}$"
          }
        }
      }
    },
    "reportDigest": {
      "type": "string",
      "pattern": "^sha256:[a-f0-9]{64}$"
    }
  }
}
