{
  "schemaVersion": "0.1",
  "kind": "p3.8-multi-model-report",
  "status": "complete",
  "sourceCommit": "1b62198699166ff2212da120d818dc7412b298bb",
  "packageLockDigest": "sha256:1d42f5d5741ea559e709cc5277e6dca155fed4c16ae0dd7c9c90b89402ce28a7",
  "suiteDigest": "sha256:3b637dede8aa7b705c73789a9fa4d4cf9f7e122b93e51cf3bed2fedbbd4b7f1b",
  "suiteFileDigest": "sha256:ec692b64540e68b012343e6f4fc117907ba295e2149f0c40bad832b264a74ec0",
  "suiteSchemaDigest": "sha256:eb29799630436f3fd831e722274b15d3ce43176ed0d811200c8e0dad60c3c327",
  "promptConfigDigest": "sha256:5968ecdacc69bf95b5bdfe33db668ef55570cb860ef32a6ae00d87f22f6886d1",
  "browser": "not-applicable",
  "os": "win32/x64",
  "measuredAt": "2026-09-21T07:52:33.620Z",
  "retention": "redacted dimension scores, bounded errors, exact token usage, and model identity only; no raw prompt or response",
  "supportedConfigs": [
    {
      "provider": "OpenAI",
      "modelSnapshot": "gpt-5.6-luna:medium",
      "configDigest": "sha256:99b6670fd378b6e48e9711c29ec7e4cccaef15532e27a32450a92a351e75b3a1",
      "repetitions": 3,
      "taskCount": 12,
      "completionRate": 1,
      "wrongActionRate": 0,
      "unauthorizedConsequentialActions": 0,
      "secretLeaks": 0,
      "criticalSafetyPassRate": 1,
      "environmentErrors": 0,
      "rawCaseRecordsDigest": "sha256:b8c07e4de999cbf712844fcfc41b02f99df76c5426ae93375b9276c04a1d920e"
    },
    {
      "provider": "OpenAI",
      "modelSnapshot": "gpt-5.6-luna:high",
      "configDigest": "sha256:b660f1aa0a4142307c03f16a3b60acacd77d2c4905edb1d8b3b705b67e3c35a7",
      "repetitions": 3,
      "taskCount": 12,
      "completionRate": 1,
      "wrongActionRate": 0,
      "unauthorizedConsequentialActions": 0,
      "secretLeaks": 0,
      "criticalSafetyPassRate": 1,
      "environmentErrors": 0,
      "rawCaseRecordsDigest": "sha256:ab3488a700b3435be15116101e2fb1c0f4d85922ea6229c330692664869c67c5"
    }
  ],
  "reportDigest": "sha256:f16336afac588414e0979f91da4bae704b8b44db540fd253e7bc7ca04357a96a"
}
